{
  "$schema": "../schemas/questions.schema.json",
  "schemaVersion": "1.0.0",
  "fileType": "questions",
  "languages": ["en", "te", "hi"],
  "updated": "2026-08-01",
  "description": "Hand-authored question bank. Sample covers Class 5 and Class 8 with one question of every type in each class.",
  "questions": [
    {
      "id": "q-c5-001",
      "class": 5,
      "type": "mcq",
      "category": "Vocabulary Building",
      "tags": ["daily", "beginner", "verbs"],
      "text": {
        "en": "What is the closest meaning of the word \"abandon\"?",
        "te": "\"abandon\" అనే పదానికి దగ్గరి అర్థం ఏమిటి?",
        "hi": "\"abandon\" शब्द का निकटतम अर्थ क्या है?"
      },
      "options": {
        "en": ["Leave behind", "Keep safe", "Build again", "Praise"],
        "te": ["వదిలివేయడం", "భద్రంగా ఉంచడం", "మళ్ళీ నిర్మించడం", "ప్రశంసించడం"],
        "hi": ["छोड़ देना", "सुरक्षित रखना", "फिर से बनाना", "प्रशंसा करना"]
      },
      "correctAnswer": 0,
      "explanation": {
        "en": "\"Abandon\" means to leave a person or thing behind and not come back for it.",
        "te": "\"Abandon\" అంటే ఒక వ్యక్తిని లేదా వస్తువును వదిలివేసి తిరిగి రాకపోవడం.",
        "hi": "\"Abandon\" का अर्थ है किसी व्यक्ति या वस्तु को छोड़ देना और उसके लिए वापस न आना।"
      },
      "source": { "kind": "static" }
    },
    {
      "id": "q-c5-002",
      "class": 5,
      "type": "true-false",
      "category": "Grammar",
      "tags": ["school", "beginner", "tenses"],
      "text": {
        "en": "The sentence \"She go to school every day.\" is grammatically correct.",
        "te": "\"She go to school every day.\" అనే వాక్యం వ్యాకరణపరంగా సరైనది.",
        "hi": "\"She go to school every day.\" यह वाक्य व्याकरण की दृष्टि से सही है।"
      },
      "options": {
        "en": ["True", "False"],
        "te": ["నిజం", "అబద్ధం"],
        "hi": ["सही", "ग़लत"]
      },
      "correctAnswer": false,
      "explanation": {
        "en": "With he / she / it the verb takes -s in the simple present: \"She goes to school every day.\"",
        "te": "he / she / it తో సింపుల్ ప్రెజెంట్‌లో క్రియకు -s చేరుతుంది: \"She goes to school every day.\"",
        "hi": "he / she / it के साथ सिंपल प्रेज़ेंट में क्रिया में -s जुड़ता है: \"She goes to school every day.\""
      },
      "source": { "kind": "static" }
    },
    {
      "id": "q-c5-003",
      "class": 5,
      "type": "flip-card",
      "category": "Phrase Learning",
      "tags": ["daily", "intermediate", "phrases"],
      "text": {
        "en": "What does the phrase \"break the ice\" mean?",
        "te": "\"break the ice\" అనే పదబంధానికి అర్థం ఏమిటి?",
        "hi": "\"break the ice\" वाक्यांश का क्या अर्थ है?"
      },
      "options": {
        "front": {
          "en": "Think of an answer, then tap to see the choices.",
          "te": "సమాధానం ఆలోచించండి, తర్వాత ఎంపికలు చూడటానికి నొక్కండి.",
          "hi": "उत्तर सोचिए, फिर विकल्प देखने के लिए टैप कीजिए।"
        },
        "choices": {
          "en": ["To start a conversation", "To break something cold", "To make a mistake", "To finish a task"],
          "te": ["సంభాషణ ప్రారంభించడం", "చల్లని వస్తువును పగలగొట్టడం", "పొరపాటు చేయడం", "పనిని పూర్తి చేయడం"],
          "hi": ["बातचीत शुरू करना", "कोई ठंडी चीज़ तोड़ना", "ग़लती करना", "काम पूरा करना"]
        }
      },
      "correctAnswer": 0,
      "explanation": {
        "en": "\"Break the ice\" means to say something friendly so that strangers begin to talk comfortably.",
        "te": "\"Break the ice\" అంటే కొత్తవాళ్ళు హాయిగా మాట్లాడటం మొదలుపెట్టేలా స్నేహపూర్వకంగా ఏదైనా చెప్పడం.",
        "hi": "\"Break the ice\" का अर्थ है कुछ दोस्ताना कहना ताकि अजनबी सहज होकर बात करने लगें।"
      },
      "source": { "kind": "static" }
    },
    {
      "id": "q-c5-004",
      "class": 5,
      "type": "drag-drop",
      "category": "Sentence Formation",
      "tags": ["daily", "intermediate", "word-order"],
      "text": {
        "en": "Drag the chunks into order to make a correct English sentence.",
        "te": "సరైన ఆంగ్ల వాక్యం ఏర్పడేలా భాగాలను వరుసలో అమర్చండి.",
        "hi": "सही अंग्रेज़ी वाक्य बनाने के लिए टुकड़ों को क्रम में लगाइए।"
      },
      "options": {
        "tokens": {
          "en": ["in the park", "She", "every evening", "is playing"],
          "te": ["పార్క్‌లో", "ఆమె", "ప్రతి సాయంత్రం", "ఆడుతోంది"],
          "hi": ["पार्क में", "वह", "हर शाम", "खेल रही है"]
        },
        "target": {
          "en": "She is playing in the park every evening.",
          "te": "ఆమె ప్రతి సాయంత్రం పార్క్‌లో ఆడుతోంది.",
          "hi": "वह हर शाम पार्क में खेल रही है।"
        },
        "taskLanguage": "en"
      },
      "correctAnswer": [1, 3, 0, 2],
      "explanation": {
        "en": "English order is subject + verb + place + time. Telugu and Hindi put the time and place before the verb, so compare the target sentence carefully.",
        "te": "ఆంగ్లంలో క్రమం: కర్త + క్రియ + స్థలం + కాలం. తెలుగులో స్థలం, కాలం క్రియకు ముందు వస్తాయి, కాబట్టి లక్ష్య వాక్యాన్ని జాగ్రత్తగా పోల్చండి.",
        "hi": "अंग्रेज़ी का क्रम है: कर्ता + क्रिया + स्थान + समय। हिन्दी में समय और स्थान क्रिया से पहले आते हैं, इसलिए लक्ष्य वाक्य से ध्यान से मिलाइए।"
      },
      "source": { "kind": "static" }
    },
    {
      "id": "q-c5-005",
      "class": 5,
      "type": "match-pairs",
      "category": "Vocabulary Building",
      "tags": ["daily", "intermediate", "adjectives"],
      "text": {
        "en": "Match each English word with its meaning.",
        "te": "ప్రతి ఆంగ్ల పదాన్ని దాని అర్థంతో జతపరచండి.",
        "hi": "प्रत्येक अंग्रेज़ी शब्द को उसके अर्थ से मिलाइए।"
      },
      "options": {
        "left": {
          "en": ["brave", "tiny", "rapid", "gloomy"],
          "te": ["brave", "tiny", "rapid", "gloomy"],
          "hi": ["brave", "tiny", "rapid", "gloomy"]
        },
        "right": {
          "en": ["very fast", "not afraid of danger", "sad and dark", "very small"],
          "te": ["చాలా వేగవంతమైన", "ప్రమాదానికి భయపడని", "విచారంగా, చీకటిగా", "చాలా చిన్న"],
          "hi": ["बहुत तेज़", "ख़तरे से न डरने वाला", "उदास और अंधेरा", "बहुत छोटा"]
        }
      },
      "correctAnswer": [[0, 1], [1, 3], [2, 0], [3, 2]],
      "explanation": {
        "en": "The left column keeps the English word untranslated because that word is what is being learned; only the meanings are given in Telugu and Hindi.",
        "te": "నేర్చుకుంటున్నది ఆంగ్ల పదమే కాబట్టి ఎడమ వరుసలో అది అనువదించకుండా ఉంచాం; అర్థాలు మాత్రమే తెలుగు, హిందీలో ఇచ్చాం.",
        "hi": "सीखा जाने वाला शब्द अंग्रेज़ी का ही है, इसलिए बाईं ओर उसे अनुवाद किए बिना रखा गया है; केवल अर्थ तेलुगु और हिन्दी में दिए गए हैं।"
      },
      "source": { "kind": "static" }
    },

    {
      "id": "q-c8-001",
      "class": 8,
      "type": "mcq",
      "category": "Error Correction",
      "tags": ["school", "advanced", "agreement"],
      "text": {
        "en": "Choose the grammatically correct sentence.",
        "te": "వ్యాకరణపరంగా సరైన వాక్యాన్ని ఎంచుకోండి.",
        "hi": "व्याकरण की दृष्टि से सही वाक्य चुनिए।"
      },
      "options": {
        "en": [
          "Neither of the boys has finished his homework.",
          "Neither of the boys have finished their homework.",
          "Neither of the boys has finished their homework.",
          "Neither of the boys have finished his homework."
        ],
        "te": [
          "Neither of the boys has finished his homework.",
          "Neither of the boys have finished their homework.",
          "Neither of the boys has finished their homework.",
          "Neither of the boys have finished his homework."
        ],
        "hi": [
          "Neither of the boys has finished his homework.",
          "Neither of the boys have finished their homework.",
          "Neither of the boys has finished their homework.",
          "Neither of the boys have finished his homework."
        ]
      },
      "correctAnswer": 0,
      "explanation": {
        "en": "\"Neither\" is singular, so it takes a singular verb (has) and a singular pronoun (his). The option text is not translated because the English sentence itself is what the student must judge.",
        "te": "\"Neither\" ఏకవచనం, కాబట్టి ఏకవచన క్రియ (has), ఏకవచన సర్వనామం (his) వాడాలి. విద్యార్థి పరిశీలించవలసినది ఆంగ్ల వాక్యమే కాబట్టి ఎంపికలను అనువదించలేదు.",
        "hi": "\"Neither\" एकवचन है, इसलिए एकवचन क्रिया (has) और एकवचन सर्वनाम (his) आता है। छात्र को अंग्रेज़ी वाक्य ही परखना है, इसलिए विकल्पों का अनुवाद नहीं किया गया।"
      },
      "source": { "kind": "static" }
    },
    {
      "id": "q-c8-002",
      "class": 8,
      "type": "true-false",
      "category": "Pronunciation Awareness",
      "tags": ["advanced", "spelling", "silent-letters"],
      "text": {
        "en": "In the word \"knife\", the letter \"k\" is silent.",
        "te": "\"knife\" అనే పదంలో \"k\" అక్షరాన్ని ఉచ్చరించరు.",
        "hi": "\"knife\" शब्द में \"k\" अक्षर मौन (साइलेंट) होता है।"
      },
      "options": {
        "en": ["True", "False"],
        "te": ["నిజం", "అబద్ధం"],
        "hi": ["सही", "ग़लत"]
      },
      "correctAnswer": true,
      "explanation": {
        "en": "English words beginning with kn- (knife, knee, knock, know) drop the k sound: knife is said /naɪf/.",
        "te": "kn- తో మొదలయ్యే ఆంగ్ల పదాలలో (knife, knee, knock, know) k ధ్వని ఉండదు: knife ను /naɪf/ అని పలుకుతారు.",
        "hi": "kn- से शुरू होने वाले अंग्रेज़ी शब्दों (knife, knee, knock, know) में k की ध्वनि नहीं आती: knife को /naɪf/ बोला जाता है।"
      },
      "source": { "kind": "static" }
    },
    {
      "id": "q-c8-003",
      "class": 8,
      "type": "flip-card",
      "category": "Idioms & Expressions",
      "tags": ["daily", "advanced", "idioms"],
      "text": {
        "en": "What does the idiom \"once in a blue moon\" mean?",
        "te": "\"once in a blue moon\" అనే జాతీయానికి అర్థం ఏమిటి?",
        "hi": "\"once in a blue moon\" मुहावरे का क्या अर्थ है?"
      },
      "options": {
        "front": {